{
  "version": 1,
  "name": "notebook",
  "label": "Notebook",
  "description": "Handwritten notebook feel (Architects Daughter).",
  "recommended": true,
  "radius": "0.625rem",
  "letterSpacing": "0.5px",
  "fonts": {
    "sans": "Architects Daughter, sans-serif",
    "serif": "Georgia, serif",
    "mono": "Fira Code, Courier New, monospace",
    "files": [
      "https://fonts.googleapis.com/css2?family=Architects+Daughter&family=Fira+Code:wght@300..700&display=swap"
    ]
  },
  "light": {
    "background": "oklch(0.9821 0 0)",
    "foreground": "oklch(0.3485 0 0)",
    "card": "oklch(1.0000 0 0)",
    "cardForeground": "oklch(0.3485 0 0)",
    "popover": "oklch(1.0000 0 0)",
    "popoverForeground": "oklch(0.3485 0 0)",
    "primary": "oklch(0.4891 0 0)",
    "primaryForeground": "oklch(0.9551 0 0)",
    "secondary": "oklch(0.9006 0 0)",
    "secondaryForeground": "oklch(0.3485 0 0)",
    "muted": "oklch(0.9158 0 0)",
    "mutedForeground": "oklch(0.4313 0 0)",
    "accent": "oklch(0.9354 0.0456 94.8549)",
    "accentForeground": "oklch(0.4015 0.0436 37.9587)",
    "destructive": "oklch(0.6627 0.0978 20.0041)",
    "destructiveForeground": "oklch(1.0000 0 0)",
    "border": "oklch(0.5538 0.0025 17.2320)",
    "input": "oklch(1.0000 0 0)",
    "ring": "oklch(0.7058 0 0)",
    "chart1": "oklch(0.3211 0 0)",
    "chart2": "oklch(0.4495 0 0)",
    "chart3": "oklch(0.5693 0 0)",
    "chart4": "oklch(0.6830 0 0)",
    "chart5": "oklch(0.7921 0 0)",
    "radius": "0.625rem",
    "sidebarBackground": "oklch(0.9551 0 0)",
    "sidebarForeground": "oklch(0.3485 0 0)",
    "sidebarPrimary": "oklch(0.4891 0 0)",
    "sidebarPrimaryForeground": "oklch(0.9551 0 0)",
    "sidebarAccent": "oklch(0.9354 0.0456 94.8549)",
    "sidebarAccentForeground": "oklch(0.4015 0.0436 37.9587)",
    "sidebarBorder": "oklch(0.8078 0 0)",
    "sidebarRing": "oklch(0.7058 0 0)"
  },
  "dark": {
    "background": "oklch(0.2891 0 0)",
    "foreground": "oklch(0.8945 0 0)",
    "card": "oklch(0.3211 0 0)",
    "cardForeground": "oklch(0.8945 0 0)",
    "popover": "oklch(0.3211 0 0)",
    "popoverForeground": "oklch(0.8945 0 0)",
    "primary": "oklch(0.7572 0 0)",
    "primaryForeground": "oklch(0.2891 0 0)",
    "secondary": "oklch(0.4676 0 0)",
    "secondaryForeground": "oklch(0.8078 0 0)",
    "muted": "oklch(0.3904 0 0)",
    "mutedForeground": "oklch(0.7058 0 0)",
    "accent": "oklch(0.9067 0 0)",
    "accentForeground": "oklch(0.3211 0 0)",
    "destructive": "oklch(0.7915 0.0491 18.2410)",
    "destructiveForeground": "oklch(0.2891 0 0)",
    "border": "oklch(0.4276 0 0)",
    "input": "oklch(0.3211 0 0)",
    "ring": "oklch(0.8078 0 0)",
    "chart1": "oklch(0.9521 0 0)",
    "chart2": "oklch(0.8576 0 0)",
    "chart3": "oklch(0.7572 0 0)",
    "chart4": "oklch(0.6534 0 0)",
    "chart5": "oklch(0.5452 0 0)",
    "radius": "0.625rem",
    "sidebarBackground": "oklch(0.2478 0 0)",
    "sidebarForeground": "oklch(0.8945 0 0)",
    "sidebarPrimary": "oklch(0.7572 0 0)",
    "sidebarPrimaryForeground": "oklch(0.2478 0 0)",
    "sidebarAccent": "oklch(0.9067 0 0)",
    "sidebarAccentForeground": "oklch(0.3211 0 0)",
    "sidebarBorder": "oklch(0.4276 0 0)",
    "sidebarRing": "oklch(0.8078 0 0)"
  }
}
