{
  "version": 1,
  "name": "darkmatter",
  "label": "Darkmatter",
  "description": "Amber primary with mono-first UI (Geist Mono + JetBrains Mono).",
  "recommended": true,
  "radius": "0.75rem",
  "fonts": {
    "sans": "Geist Mono, ui-monospace, monospace",
    "serif": "serif",
    "mono": "JetBrains Mono, monospace",
    "files": [
      "https://fonts.googleapis.com/css2?family=Geist+Mono:wght@100..900&family=JetBrains+Mono:wght@100..800&display=swap"
    ]
  },
  "light": {
    "background": "oklch(1.0000 0 0)",
    "foreground": "oklch(0.2101 0.0318 264.6645)",
    "card": "oklch(1.0000 0 0)",
    "cardForeground": "oklch(0.2101 0.0318 264.6645)",
    "popover": "oklch(1.0000 0 0)",
    "popoverForeground": "oklch(0.2101 0.0318 264.6645)",
    "primary": "oklch(0.6716 0.1368 48.5130)",
    "primaryForeground": "oklch(1.0000 0 0)",
    "secondary": "oklch(0.5360 0.0398 196.0280)",
    "secondaryForeground": "oklch(1.0000 0 0)",
    "muted": "oklch(0.9670 0.0029 264.5419)",
    "mutedForeground": "oklch(0.5510 0.0234 264.3637)",
    "accent": "oklch(0.9491 0 0)",
    "accentForeground": "oklch(0.2101 0.0318 264.6645)",
    "destructive": "oklch(0.6368 0.2078 25.3313)",
    "destructiveForeground": "oklch(0.9851 0 0)",
    "border": "oklch(0.9276 0.0058 264.5313)",
    "input": "oklch(0.9276 0.0058 264.5313)",
    "ring": "oklch(0.6716 0.1368 48.5130)",
    "radius": "0.75rem",
    "sidebarBackground": "oklch(0.9670 0.0029 264.5419)",
    "sidebarForeground": "oklch(0.2101 0.0318 264.6645)",
    "sidebarPrimary": "oklch(0.6716 0.1368 48.5130)",
    "sidebarPrimaryForeground": "oklch(1.0000 0 0)",
    "sidebarAccent": "oklch(1.0000 0 0)",
    "sidebarAccentForeground": "oklch(0.2101 0.0318 264.6645)",
    "sidebarBorder": "oklch(0.9276 0.0058 264.5313)",
    "sidebarRing": "oklch(0.6716 0.1368 48.5130)",
    "chart1": "oklch(0.5940 0.0443 196.0233)",
    "chart2": "oklch(0.7214 0.1337 49.9802)",
    "chart3": "oklch(0.8721 0.0864 68.5474)",
    "chart4": "oklch(0.6268 0 0)",
    "chart5": "oklch(0.6830 0 0)"
  },
  "dark": {
    "background": "oklch(0.1797 0.0043 308.1928)",
    "foreground": "oklch(0.8109 0 0)",
    "card": "oklch(0.1822 0 0)",
    "cardForeground": "oklch(0.8109 0 0)",
    "popover": "oklch(0.1797 0.0043 308.1928)",
    "popoverForeground": "oklch(0.8109 0 0)",
    "primary": "oklch(0.7214 0.1337 49.9802)",
    "primaryForeground": "oklch(0.1797 0.0043 308.1928)",
    "secondary": "oklch(0.5940 0.0443 196.0233)",
    "secondaryForeground": "oklch(0.1797 0.0043 308.1928)",
    "muted": "oklch(0.2520 0 0)",
    "mutedForeground": "oklch(0.6268 0 0)",
    "accent": "oklch(0.3211 0 0)",
    "accentForeground": "oklch(0.8109 0 0)",
    "destructive": "oklch(0.5940 0.0443 196.0233)",
    "destructiveForeground": "oklch(0.1797 0.0043 308.1928)",
    "border": "oklch(0.2520 0 0)",
    "input": "oklch(0.2520 0 0)",
    "ring": "oklch(0.7214 0.1337 49.9802)",
    "radius": "0.75rem",
    "sidebarBackground": "oklch(0.1822 0 0)",
    "sidebarForeground": "oklch(0.8109 0 0)",
    "sidebarPrimary": "oklch(0.7214 0.1337 49.9802)",
    "sidebarPrimaryForeground": "oklch(0.1797 0.0043 308.1928)",
    "sidebarAccent": "oklch(0.3211 0 0)",
    "sidebarAccentForeground": "oklch(0.8109 0 0)",
    "sidebarBorder": "oklch(0.2520 0 0)",
    "sidebarRing": "oklch(0.7214 0.1337 49.9802)",
    "chart1": "oklch(0.5940 0.0443 196.0233)",
    "chart2": "oklch(0.7214 0.1337 49.9802)",
    "chart3": "oklch(0.8721 0.0864 68.5474)",
    "chart4": "oklch(0.6268 0 0)",
    "chart5": "oklch(0.6830 0 0)"
  }
}
