{
  "version": 1,
  "name": "violet-bloom",
  "label": "Violet Bloom",
  "description": "Bold violet bloom with tight tracking (Plus Jakarta Sans + Lora).",
  "recommended": true,
  "radius": "1.4rem",
  "letterSpacing": "-0.025em",
  "fonts": {
    "sans": "Plus Jakarta Sans, sans-serif",
    "serif": "Lora, serif",
    "mono": "IBM Plex Mono, monospace",
    "files": [
      "https://fonts.googleapis.com/css2?family=IBM+Plex+Mono:ital,wght@0,100..700;1,100..700&family=Lora:ital,wght@0,400..700;1,400..700&family=Plus+Jakarta+Sans:ital,wght@0,200..800;1,200..800&display=swap"
    ]
  },
  "light": {
    "background": "oklch(0.9940 0 0)",
    "foreground": "oklch(0 0 0)",
    "card": "oklch(0.9940 0 0)",
    "cardForeground": "oklch(0 0 0)",
    "popover": "oklch(0.9911 0 0)",
    "popoverForeground": "oklch(0 0 0)",
    "primary": "oklch(0.5393 0.2713 286.7462)",
    "primaryForeground": "oklch(1.0000 0 0)",
    "secondary": "oklch(0.9540 0.0063 255.4755)",
    "secondaryForeground": "oklch(0.1344 0 0)",
    "muted": "oklch(0.9702 0 0)",
    "mutedForeground": "oklch(0.4386 0 0)",
    "accent": "oklch(0.9393 0.0288 266.3680)",
    "accentForeground": "oklch(0.5445 0.1903 259.4848)",
    "destructive": "oklch(0.6290 0.1902 23.0704)",
    "destructiveForeground": "oklch(1.0000 0 0)",
    "border": "oklch(0.9300 0.0094 286.2156)",
    "input": "oklch(0.9401 0 0)",
    "ring": "oklch(0 0 0)",
    "chart1": "oklch(0.7459 0.1483 156.4499)",
    "chart2": "oklch(0.5393 0.2713 286.7462)",
    "chart3": "oklch(0.7336 0.1758 50.5517)",
    "chart4": "oklch(0.5828 0.1809 259.7276)",
    "chart5": "oklch(0.5590 0 0)",
    "radius": "1.4rem",
    "sidebarBackground": "oklch(0.9777 0.0051 247.8763)",
    "sidebarForeground": "oklch(0 0 0)",
    "sidebarPrimary": "oklch(0 0 0)",
    "sidebarPrimaryForeground": "oklch(1.0000 0 0)",
    "sidebarAccent": "oklch(0.9401 0 0)",
    "sidebarAccentForeground": "oklch(0 0 0)",
    "sidebarBorder": "oklch(0.9401 0 0)",
    "sidebarRing": "oklch(0 0 0)"
  },
  "dark": {
    "background": "oklch(0.2223 0.0060 271.1393)",
    "foreground": "oklch(0.9551 0 0)",
    "card": "oklch(0.2568 0.0076 274.6528)",
    "cardForeground": "oklch(0.9551 0 0)",
    "popover": "oklch(0.2568 0.0076 274.6528)",
    "popoverForeground": "oklch(0.9551 0 0)",
    "primary": "oklch(0.6132 0.2294 291.7437)",
    "primaryForeground": "oklch(1.0000 0 0)",
    "secondary": "oklch(0.2940 0.0130 272.9312)",
    "secondaryForeground": "oklch(0.9551 0 0)",
    "muted": "oklch(0.2940 0.0130 272.9312)",
    "mutedForeground": "oklch(0.7058 0 0)",
    "accent": "oklch(0.2795 0.0368 260.0310)",
    "accentForeground": "oklch(0.7857 0.1153 246.6596)",
    "destructive": "oklch(0.7106 0.1661 22.2162)",
    "destructiveForeground": "oklch(1.0000 0 0)",
    "border": "oklch(0.3289 0.0092 268.3843)",
    "input": "oklch(0.3289 0.0092 268.3843)",
    "ring": "oklch(0.6132 0.2294 291.7437)",
    "chart1": "oklch(0.8003 0.1821 151.7110)",
    "chart2": "oklch(0.6132 0.2294 291.7437)",
    "chart3": "oklch(0.8077 0.1035 19.5706)",
    "chart4": "oklch(0.6691 0.1569 260.1063)",
    "chart5": "oklch(0.7058 0 0)",
    "radius": "1.4rem",
    "sidebarBackground": "oklch(0.2011 0.0039 286.0396)",
    "sidebarForeground": "oklch(0.9551 0 0)",
    "sidebarPrimary": "oklch(0.6132 0.2294 291.7437)",
    "sidebarPrimaryForeground": "oklch(1.0000 0 0)",
    "sidebarAccent": "oklch(0.2940 0.0130 272.9312)",
    "sidebarAccentForeground": "oklch(0.6132 0.2294 291.7437)",
    "sidebarBorder": "oklch(0.3289 0.0092 268.3843)",
    "sidebarRing": "oklch(0.6132 0.2294 291.7437)"
  }
}
