{
  "version": 1,
  "name": "shellui",
  "label": "Shellui",
  "description": "Official Shellui theme — gold brand from shellui.com.",
  "recommended": true,
  "radius": "0.5rem",
  "fonts": {
    "sans": "system-ui, -apple-system, BlinkMacSystemFont, \"Segoe UI\", Roboto, sans-serif",
    "mono": "ui-monospace, SFMono-Regular, Menlo, Monaco, Consolas, monospace"
  },
  "light": {
    "background": "oklch(1.0000 0.0001 263.2831)",
    "foreground": "oklch(0.2101 0.0318 264.6685)",
    "card": "oklch(0.9846 0.0018 248.5713)",
    "cardForeground": "oklch(0.2101 0.0318 264.6685)",
    "popover": "oklch(1.0000 0.0001 263.2831)",
    "popoverForeground": "oklch(0.2101 0.0318 264.6685)",
    "primary": "oklch(0.7609 0.1541 80.8397)",
    "primaryForeground": "oklch(0.1950 0.0239 83.9752)",
    "secondary": "oklch(0.9670 0.0030 264.5101)",
    "secondaryForeground": "oklch(0.2101 0.0318 264.6685)",
    "muted": "oklch(0.9670 0.0030 264.5101)",
    "mutedForeground": "oklch(0.5510 0.0234 264.3657)",
    "accent": "oklch(0.9670 0.0030 264.5101)",
    "accentForeground": "oklch(0.2101 0.0318 264.6685)",
    "destructive": "oklch(0.5771 0.2151 27.3175)",
    "destructiveForeground": "oklch(1.0000 0.0001 263.2831)",
    "border": "oklch(0.9276 0.0059 264.5182)",
    "input": "oklch(0.9276 0.0059 264.5182)",
    "ring": "oklch(0.6894 0.1397 83.6763)",
    "radius": "0.5rem",
    "sidebarBackground": "oklch(0.9846 0.0018 248.5713)",
    "sidebarForeground": "oklch(0.4461 0.0264 256.8155)",
    "sidebarPrimary": "oklch(0.7609 0.1541 80.8397)",
    "sidebarPrimaryForeground": "oklch(0.1950 0.0239 83.9752)",
    "sidebarAccent": "oklch(0.9670 0.0030 264.5101)",
    "sidebarAccentForeground": "oklch(0.2101 0.0318 264.6685)",
    "sidebarBorder": "oklch(0.9276 0.0059 264.5182)",
    "sidebarRing": "oklch(0.6894 0.1397 83.6763)",
    "chart1": "oklch(0.7609 0.1541 80.8397)",
    "chart2": "oklch(0.6894 0.1397 83.6763)",
    "chart3": "oklch(0.5510 0.0234 264.3657)",
    "chart4": "oklch(0.4461 0.0264 256.8155)",
    "chart5": "oklch(0.8061 0.1364 84.8895)"
  },
  "dark": {
    "background": "oklch(0.1296 0.0274 261.6981)",
    "foreground": "oklch(0.9846 0.0018 248.5713)",
    "card": "oklch(0.2101 0.0318 264.6685)",
    "cardForeground": "oklch(0.9846 0.0018 248.5713)",
    "popover": "oklch(0.2101 0.0318 264.6685)",
    "popoverForeground": "oklch(0.9846 0.0018 248.5713)",
    "primary": "oklch(0.8061 0.1364 84.8895)",
    "primaryForeground": "oklch(0.1950 0.0239 83.9752)",
    "secondary": "oklch(0.2781 0.0296 256.8577)",
    "secondaryForeground": "oklch(0.9846 0.0018 248.5713)",
    "muted": "oklch(0.2781 0.0296 256.8577)",
    "mutedForeground": "oklch(0.7137 0.0192 261.3350)",
    "accent": "oklch(0.2781 0.0296 256.8577)",
    "accentForeground": "oklch(0.9846 0.0018 248.5713)",
    "destructive": "oklch(0.6369 0.2078 25.3221)",
    "destructiveForeground": "oklch(1.0000 0.0001 263.2831)",
    "border": "oklch(0.2781 0.0296 256.8577)",
    "input": "oklch(0.2781 0.0296 256.8577)",
    "ring": "oklch(0.8061 0.1364 84.8895)",
    "radius": "0.5rem",
    "sidebarBackground": "oklch(0.2101 0.0318 264.6685)",
    "sidebarForeground": "oklch(0.9276 0.0059 264.5182)",
    "sidebarPrimary": "oklch(0.8061 0.1364 84.8895)",
    "sidebarPrimaryForeground": "oklch(0.1950 0.0239 83.9752)",
    "sidebarAccent": "oklch(0.2781 0.0296 256.8577)",
    "sidebarAccentForeground": "oklch(0.9846 0.0018 248.5713)",
    "sidebarBorder": "oklch(0.2781 0.0296 256.8577)",
    "sidebarRing": "oklch(0.8061 0.1364 84.8895)",
    "chart1": "oklch(0.8061 0.1364 84.8895)",
    "chart2": "oklch(0.7609 0.1541 80.8397)",
    "chart3": "oklch(0.7137 0.0192 261.3350)",
    "chart4": "oklch(0.5510 0.0234 264.3657)",
    "chart5": "oklch(0.6894 0.1397 83.6763)"
  }
}
