{
  "version": 1,
  "name": "kodama-grove",
  "label": "Kodama Grove",
  "description": "Earthy moss greens on warm parchment (Merriweather + Source Serif 4).",
  "recommended": true,
  "radius": "0.425rem",
  "fonts": {
    "sans": "Merriweather, serif",
    "serif": "Source Serif 4, serif",
    "mono": "JetBrains Mono, monospace",
    "files": [
      "https://fonts.googleapis.com/css2?family=JetBrains+Mono:wght@100..800&family=Merriweather:ital,wght@0,300..900;1,300..900&family=Source+Serif+4:ital,opsz,wght@0,8..60,200..900;1,8..60,200..900&display=swap"
    ]
  },
  "light": {
    "background": "oklch(0.8798 0.0534 91.7893)",
    "foreground": "oklch(0.4265 0.0310 59.2153)",
    "card": "oklch(0.8937 0.0395 87.5676)",
    "cardForeground": "oklch(0.4265 0.0310 59.2153)",
    "popover": "oklch(0.9378 0.0331 89.8515)",
    "popoverForeground": "oklch(0.4265 0.0310 59.2153)",
    "primary": "oklch(0.6657 0.1050 118.9078)",
    "primaryForeground": "oklch(0.9882 0.0069 88.6415)",
    "secondary": "oklch(0.8532 0.0631 91.1493)",
    "secondaryForeground": "oklch(0.4265 0.0310 59.2153)",
    "muted": "oklch(0.8532 0.0631 91.1493)",
    "mutedForeground": "oklch(0.5761 0.0259 60.9323)",
    "accent": "oklch(0.8361 0.0713 90.3269)",
    "accentForeground": "oklch(0.4265 0.0310 59.2153)",
    "destructive": "oklch(0.7136 0.0981 29.9827)",
    "destructiveForeground": "oklch(0.9790 0.0082 91.4818)",
    "border": "oklch(0.6918 0.0440 59.8448)",
    "input": "oklch(0.8361 0.0713 90.3269)",
    "ring": "oklch(0.7350 0.0564 130.8494)",
    "chart1": "oklch(0.7350 0.0564 130.8494)",
    "chart2": "oklch(0.6762 0.0567 132.4479)",
    "chart3": "oklch(0.8185 0.0332 136.6539)",
    "chart4": "oklch(0.5929 0.0464 137.6224)",
    "chart5": "oklch(0.5183 0.0390 137.1892)",
    "radius": "0.425rem",
    "sidebarBackground": "oklch(0.8631 0.0645 90.5161)",
    "sidebarForeground": "oklch(0.4265 0.0310 59.2153)",
    "sidebarPrimary": "oklch(0.7350 0.0564 130.8494)",
    "sidebarPrimaryForeground": "oklch(0.9882 0.0069 88.6415)",
    "sidebarAccent": "oklch(0.9225 0.0169 88.0027)",
    "sidebarAccentForeground": "oklch(0.4265 0.0310 59.2153)",
    "sidebarBorder": "oklch(0.9073 0.0170 88.0044)",
    "sidebarRing": "oklch(0.7350 0.0564 130.8494)"
  },
  "dark": {
    "background": "oklch(0.3303 0.0214 88.0737)",
    "foreground": "oklch(0.9217 0.0235 82.1191)",
    "card": "oklch(0.3583 0.0165 82.3257)",
    "cardForeground": "oklch(0.9217 0.0235 82.1191)",
    "popover": "oklch(0.3583 0.0165 82.3257)",
    "popoverForeground": "oklch(0.9217 0.0235 82.1191)",
    "primary": "oklch(0.6762 0.0567 132.4479)",
    "primaryForeground": "oklch(0.2686 0.0105 61.0213)",
    "secondary": "oklch(0.4448 0.0239 84.5498)",
    "secondaryForeground": "oklch(0.9217 0.0235 82.1191)",
    "muted": "oklch(0.3892 0.0197 82.7084)",
    "mutedForeground": "oklch(0.7096 0.0171 73.6179)",
    "accent": "oklch(0.6540 0.0723 90.7629)",
    "accentForeground": "oklch(0.2686 0.0105 61.0213)",
    "destructive": "oklch(0.6287 0.0821 31.2958)",
    "destructiveForeground": "oklch(0.9357 0.0201 84.5907)",
    "border": "oklch(0.4448 0.0239 84.5498)",
    "input": "oklch(0.4448 0.0239 84.5498)",
    "ring": "oklch(0.6762 0.0567 132.4479)",
    "chart1": "oklch(0.6762 0.0567 132.4479)",
    "chart2": "oklch(0.7350 0.0564 130.8494)",
    "chart3": "oklch(0.5929 0.0464 137.6224)",
    "chart4": "oklch(0.6540 0.0723 90.7629)",
    "chart5": "oklch(0.5183 0.0390 137.1892)",
    "radius": "0.425rem",
    "sidebarBackground": "oklch(0.3303 0.0214 88.0737)",
    "sidebarForeground": "oklch(0.9217 0.0235 82.1191)",
    "sidebarPrimary": "oklch(0.6762 0.0567 132.4479)",
    "sidebarPrimaryForeground": "oklch(0.2686 0.0105 61.0213)",
    "sidebarAccent": "oklch(0.6540 0.0723 90.7629)",
    "sidebarAccentForeground": "oklch(0.2686 0.0105 61.0213)",
    "sidebarBorder": "oklch(0.4448 0.0239 84.5498)",
    "sidebarRing": "oklch(0.6762 0.0567 132.4479)"
  }
}
