{
  "version": 1,
  "name": "cyberpunk",
  "label": "Cyberpunk",
  "description": "Neon magenta and cyan accents (Outfit + Fira Code).",
  "recommended": true,
  "radius": "0.5rem",
  "fonts": {
    "sans": "Outfit, sans-serif",
    "serif": "ui-serif, Georgia, Cambria, \"Times New Roman\", Times, serif",
    "mono": "Fira Code, monospace",
    "files": [
      "https://fonts.googleapis.com/css2?family=Fira+Code:wght@300..700&family=Outfit:wght@100..900&display=swap"
    ]
  },
  "light": {
    "background": "oklch(0.9816 0.0017 247.8390)",
    "foreground": "oklch(0.1649 0.0352 281.8285)",
    "card": "oklch(1.0000 0 0)",
    "cardForeground": "oklch(0.1649 0.0352 281.8285)",
    "popover": "oklch(1.0000 0 0)",
    "popoverForeground": "oklch(0.1649 0.0352 281.8285)",
    "primary": "oklch(0.6726 0.2904 341.4084)",
    "primaryForeground": "oklch(1.0000 0 0)",
    "secondary": "oklch(0.9595 0.0200 286.0164)",
    "secondaryForeground": "oklch(0.1649 0.0352 281.8285)",
    "muted": "oklch(0.9595 0.0200 286.0164)",
    "mutedForeground": "oklch(0.1649 0.0352 281.8285)",
    "accent": "oklch(0.8903 0.1739 171.2690)",
    "accentForeground": "oklch(0.1649 0.0352 281.8285)",
    "destructive": "oklch(0.6535 0.2348 34.0370)",
    "destructiveForeground": "oklch(1.0000 0 0)",
    "border": "oklch(0.9205 0.0086 225.0878)",
    "input": "oklch(0.9205 0.0086 225.0878)",
    "ring": "oklch(0.6726 0.2904 341.4084)",
    "radius": "0.5rem",
    "sidebarBackground": "oklch(0.9595 0.0200 286.0164)",
    "sidebarForeground": "oklch(0.1649 0.0352 281.8285)",
    "sidebarPrimary": "oklch(0.6726 0.2904 341.4084)",
    "sidebarPrimaryForeground": "oklch(1.0000 0 0)",
    "sidebarAccent": "oklch(0.8903 0.1739 171.2690)",
    "sidebarAccentForeground": "oklch(0.1649 0.0352 281.8285)",
    "sidebarBorder": "oklch(0.9205 0.0086 225.0878)",
    "sidebarRing": "oklch(0.6726 0.2904 341.4084)",
    "chart1": "oklch(0.6726 0.2904 341.4084)",
    "chart2": "oklch(0.5488 0.2944 299.0954)",
    "chart3": "oklch(0.8442 0.1457 209.2851)",
    "chart4": "oklch(0.8903 0.1739 171.2690)",
    "chart5": "oklch(0.9168 0.1915 101.4070)"
  },
  "dark": {
    "background": "oklch(0.1649 0.0352 281.8285)",
    "foreground": "oklch(0.9513 0.0074 260.7315)",
    "card": "oklch(0.2542 0.0611 281.1423)",
    "cardForeground": "oklch(0.9513 0.0074 260.7315)",
    "popover": "oklch(0.2542 0.0611 281.1423)",
    "popoverForeground": "oklch(0.9513 0.0074 260.7315)",
    "primary": "oklch(0.6726 0.2904 341.4084)",
    "primaryForeground": "oklch(1.0000 0 0)",
    "secondary": "oklch(0.2542 0.0611 281.1423)",
    "secondaryForeground": "oklch(0.9513 0.0074 260.7315)",
    "muted": "oklch(0.2123 0.0522 280.9917)",
    "mutedForeground": "oklch(0.6245 0.0500 278.1046)",
    "accent": "oklch(0.8903 0.1739 171.2690)",
    "accentForeground": "oklch(0.1649 0.0352 281.8285)",
    "destructive": "oklch(0.6535 0.2348 34.0370)",
    "destructiveForeground": "oklch(1.0000 0 0)",
    "border": "oklch(0.3279 0.0832 280.7890)",
    "input": "oklch(0.3279 0.0832 280.7890)",
    "ring": "oklch(0.6726 0.2904 341.4084)",
    "radius": "0.5rem",
    "sidebarBackground": "oklch(0.1649 0.0352 281.8285)",
    "sidebarForeground": "oklch(0.9513 0.0074 260.7315)",
    "sidebarPrimary": "oklch(0.6726 0.2904 341.4084)",
    "sidebarPrimaryForeground": "oklch(1.0000 0 0)",
    "sidebarAccent": "oklch(0.8903 0.1739 171.2690)",
    "sidebarAccentForeground": "oklch(0.1649 0.0352 281.8285)",
    "sidebarBorder": "oklch(0.3279 0.0832 280.7890)",
    "sidebarRing": "oklch(0.6726 0.2904 341.4084)",
    "chart1": "oklch(0.6726 0.2904 341.4084)",
    "chart2": "oklch(0.5488 0.2944 299.0954)",
    "chart3": "oklch(0.8442 0.1457 209.2851)",
    "chart4": "oklch(0.8903 0.1739 171.2690)",
    "chart5": "oklch(0.9168 0.1915 101.4070)"
  }
}
