{
  "version": 1,
  "name": "pastel-dreams",
  "label": "Pastel Dreams",
  "description": "Soft lavender pastels with large radius (Open Sans + Source Serif 4).",
  "recommended": true,
  "radius": "1.5rem",
  "fonts": {
    "sans": "Open Sans, sans-serif",
    "serif": "Source Serif 4, serif",
    "mono": "IBM Plex Mono, monospace",
    "files": [
      "https://fonts.googleapis.com/css2?family=IBM+Plex+Mono:ital,wght@0,100..700;1,100..700&family=Open+Sans:ital,wght@0,300..800;1,300..800&family=Source+Serif+4:ital,opsz,wght@0,8..60,200..900;1,8..60,200..900&display=swap"
    ]
  },
  "light": {
    "background": "oklch(0.9689 0.0090 314.7819)",
    "foreground": "oklch(0.3729 0.0306 259.7328)",
    "card": "oklch(1.0000 0 0)",
    "cardForeground": "oklch(0.3729 0.0306 259.7328)",
    "popover": "oklch(1.0000 0 0)",
    "popoverForeground": "oklch(0.3729 0.0306 259.7328)",
    "primary": "oklch(0.7090 0.1592 293.5412)",
    "primaryForeground": "oklch(1.0000 0 0)",
    "secondary": "oklch(0.9073 0.0530 306.0902)",
    "secondaryForeground": "oklch(0.4461 0.0263 256.8018)",
    "muted": "oklch(0.9464 0.0327 307.1745)",
    "mutedForeground": "oklch(0.5510 0.0234 264.3637)",
    "accent": "oklch(0.9376 0.0260 321.9388)",
    "accentForeground": "oklch(0.3729 0.0306 259.7328)",
    "destructive": "oklch(0.8077 0.1035 19.5706)",
    "destructiveForeground": "oklch(1.0000 0 0)",
    "border": "oklch(0.9073 0.0530 306.0902)",
    "input": "oklch(0.9073 0.0530 306.0902)",
    "ring": "oklch(0.7090 0.1592 293.5412)",
    "chart1": "oklch(0.7090 0.1592 293.5412)",
    "chart2": "oklch(0.6056 0.2189 292.7172)",
    "chart3": "oklch(0.5413 0.2466 293.0090)",
    "chart4": "oklch(0.4907 0.2412 292.5809)",
    "chart5": "oklch(0.4320 0.2106 292.7591)",
    "radius": "1.5rem",
    "sidebarBackground": "oklch(0.9073 0.0530 306.0902)",
    "sidebarForeground": "oklch(0.3729 0.0306 259.7328)",
    "sidebarPrimary": "oklch(0.7090 0.1592 293.5412)",
    "sidebarPrimaryForeground": "oklch(1.0000 0 0)",
    "sidebarAccent": "oklch(0.9376 0.0260 321.9388)",
    "sidebarAccentForeground": "oklch(0.3729 0.0306 259.7328)",
    "sidebarBorder": "oklch(0.9073 0.0530 306.0902)",
    "sidebarRing": "oklch(0.7090 0.1592 293.5412)"
  },
  "dark": {
    "background": "oklch(0.2161 0.0061 56.0434)",
    "foreground": "oklch(0.9299 0.0334 272.7879)",
    "card": "oklch(0.2805 0.0309 307.2326)",
    "cardForeground": "oklch(0.9299 0.0334 272.7879)",
    "popover": "oklch(0.2805 0.0309 307.2326)",
    "popoverForeground": "oklch(0.9299 0.0334 272.7879)",
    "primary": "oklch(0.7874 0.1179 295.7538)",
    "primaryForeground": "oklch(0.2161 0.0061 56.0434)",
    "secondary": "oklch(0.3416 0.0444 308.8496)",
    "secondaryForeground": "oklch(0.8717 0.0093 258.3382)",
    "muted": "oklch(0.2283 0.0375 302.9006)",
    "mutedForeground": "oklch(0.7137 0.0192 261.3246)",
    "accent": "oklch(0.3858 0.0509 304.6383)",
    "accentForeground": "oklch(0.8717 0.0093 258.3382)",
    "destructive": "oklch(0.8077 0.1035 19.5706)",
    "destructiveForeground": "oklch(0.2161 0.0061 56.0434)",
    "border": "oklch(0.3416 0.0444 308.8496)",
    "input": "oklch(0.3416 0.0444 308.8496)",
    "ring": "oklch(0.7874 0.1179 295.7538)",
    "chart1": "oklch(0.7874 0.1179 295.7538)",
    "chart2": "oklch(0.7090 0.1592 293.5412)",
    "chart3": "oklch(0.6056 0.2189 292.7172)",
    "chart4": "oklch(0.5413 0.2466 293.0090)",
    "chart5": "oklch(0.4907 0.2412 292.5809)",
    "radius": "1.5rem",
    "sidebarBackground": "oklch(0.3416 0.0444 308.8496)",
    "sidebarForeground": "oklch(0.9299 0.0334 272.7879)",
    "sidebarPrimary": "oklch(0.7874 0.1179 295.7538)",
    "sidebarPrimaryForeground": "oklch(0.2161 0.0061 56.0434)",
    "sidebarAccent": "oklch(0.3858 0.0509 304.6383)",
    "sidebarAccentForeground": "oklch(0.8717 0.0093 258.3382)",
    "sidebarBorder": "oklch(0.3416 0.0444 308.8496)",
    "sidebarRing": "oklch(0.7874 0.1179 295.7538)"
  }
}
