{
  "version": 1,
  "name": "sage-garden",
  "label": "Sage Garden",
  "description": "Muted sage greens on warm paper (Antic + JetBrains Mono).",
  "recommended": true,
  "radius": "0.35rem",
  "fonts": {
    "sans": "Antic, ui-sans-serif, sans-serif, system-ui",
    "serif": "Georgia, serif",
    "mono": "JetBrains Mono, Courier New, monospace",
    "files": [
      "https://fonts.googleapis.com/css2?family=Antic&family=JetBrains+Mono:wght@100..800&display=swap"
    ]
  },
  "light": {
    "background": "oklch(0.9761 0.0041 91.4461)",
    "foreground": "oklch(0.2417 0.0298 269.8827)",
    "card": "oklch(1.0000 0 0)",
    "cardForeground": "oklch(0.2417 0.0298 269.8827)",
    "popover": "oklch(1.0000 0 0)",
    "popoverForeground": "oklch(0.2417 0.0298 269.8827)",
    "primary": "oklch(0.6333 0.0309 154.9039)",
    "primaryForeground": "oklch(1.0000 0 0)",
    "secondary": "oklch(0.8596 0.0291 119.9919)",
    "secondaryForeground": "oklch(0.2417 0.0298 269.8827)",
    "muted": "oklch(0.9251 0.0071 88.6450)",
    "mutedForeground": "oklch(0.5510 0.0234 264.3637)",
    "accent": "oklch(0.8242 0.0221 136.6092)",
    "accentForeground": "oklch(0.2417 0.0298 269.8827)",
    "destructive": "oklch(0.5624 0.1743 26.1433)",
    "destructiveForeground": "oklch(1.0000 0 0)",
    "border": "oklch(0.9251 0.0071 88.6450)",
    "input": "oklch(1.0000 0 0)",
    "ring": "oklch(0.6333 0.0309 154.9039)",
    "chart1": "oklch(0.6333 0.0309 154.9039)",
    "chart2": "oklch(0.7209 0.0489 120.9474)",
    "chart3": "oklch(0.6744 0.0427 136.0110)",
    "chart4": "oklch(0.5510 0.0234 264.3637)",
    "chart5": "oklch(0.9251 0.0071 88.6450)",
    "radius": "0.35rem",
    "sidebarBackground": "oklch(0.9845 0.0026 106.4477)",
    "sidebarForeground": "oklch(0.2417 0.0298 269.8827)",
    "sidebarPrimary": "oklch(0.6333 0.0309 154.9039)",
    "sidebarPrimaryForeground": "oklch(1.0000 0 0)",
    "sidebarAccent": "oklch(0.9251 0.0071 88.6450)",
    "sidebarAccentForeground": "oklch(0.2417 0.0298 269.8827)",
    "sidebarBorder": "oklch(0.9251 0.0071 88.6450)",
    "sidebarRing": "oklch(0.6333 0.0309 154.9039)"
  },
  "dark": {
    "background": "oklch(0.1448 0 0)",
    "foreground": "oklch(0.9702 0 0)",
    "card": "oklch(0.1822 0 0)",
    "cardForeground": "oklch(0.9702 0 0)",
    "popover": "oklch(0.1822 0 0)",
    "popoverForeground": "oklch(0.9702 0 0)",
    "primary": "oklch(0.6333 0.0309 154.9039)",
    "primaryForeground": "oklch(0 0 0)",
    "secondary": "oklch(0.2178 0 0)",
    "secondaryForeground": "oklch(0.9702 0 0)",
    "muted": "oklch(0.2178 0 0)",
    "mutedForeground": "oklch(0.7058 0 0)",
    "accent": "oklch(0.3709 0.0248 153.9823)",
    "accentForeground": "oklch(0.9702 0 0)",
    "destructive": "oklch(0.6368 0.2078 25.3313)",
    "destructiveForeground": "oklch(1.0000 0 0)",
    "border": "oklch(0.2850 0 0)",
    "input": "oklch(0.1822 0 0)",
    "ring": "oklch(0.6333 0.0309 154.9039)",
    "chart1": "oklch(0.6333 0.0309 154.9039)",
    "chart2": "oklch(0.7209 0.0489 120.9474)",
    "chart3": "oklch(0.6744 0.0427 136.0110)",
    "chart4": "oklch(0.5510 0.0234 264.3637)",
    "chart5": "oklch(0.5096 0.0289 152.3460)",
    "radius": "0.35rem",
    "sidebarBackground": "oklch(0.1684 0 0)",
    "sidebarForeground": "oklch(0.9702 0 0)",
    "sidebarPrimary": "oklch(0.6333 0.0309 154.9039)",
    "sidebarPrimaryForeground": "oklch(1.0000 0 0)",
    "sidebarAccent": "oklch(0.2178 0 0)",
    "sidebarAccentForeground": "oklch(0.9702 0 0)",
    "sidebarBorder": "oklch(0.2850 0 0)",
    "sidebarRing": "oklch(0.6333 0.0309 154.9039)"
  }
}
