{
  "version": 1,
  "name": "light-green",
  "label": "Light Green",
  "description": "Bright lime primary on cool neutrals (Inter + JetBrains Mono).",
  "recommended": true,
  "radius": "1rem",
  "letterSpacing": "-0.01em",
  "fonts": {
    "sans": "Inter, system-ui, sans-serif",
    "serif": "Georgia, serif",
    "mono": "JetBrains Mono, monospace",
    "files": [
      "https://fonts.googleapis.com/css2?family=Inter:wght@100..900&family=JetBrains+Mono:wght@100..800&display=swap"
    ]
  },
  "light": {
    "background": "oklch(0.9892 0.0054 117.9205)",
    "foreground": "oklch(0.2077 0.0398 265.7549)",
    "card": "oklch(1.0000 0 0)",
    "cardForeground": "oklch(0.2077 0.0398 265.7549)",
    "popover": "oklch(1.0000 0 0)",
    "popoverForeground": "oklch(0.2077 0.0398 265.7549)",
    "primary": "oklch(0.8871 0.2122 128.5041)",
    "primaryForeground": "oklch(0 0 0)",
    "secondary": "oklch(0.3717 0.0392 257.2870)",
    "secondaryForeground": "oklch(0.9842 0.0034 247.8575)",
    "muted": "oklch(0.9683 0.0069 247.8956)",
    "mutedForeground": "oklch(0.5544 0.0407 257.4166)",
    "accent": "oklch(0.9819 0.0181 155.8263)",
    "accentForeground": "oklch(0.4479 0.1083 151.3277)",
    "destructive": "oklch(0.6368 0.2078 25.3313)",
    "destructiveForeground": "oklch(1.0000 0 0)",
    "border": "oklch(0.9288 0.0126 255.5078)",
    "input": "oklch(0.9288 0.0126 255.5078)",
    "ring": "oklch(0.8871 0.2122 128.5041)",
    "radius": "1rem",
    "sidebarBackground": "oklch(1.0000 0 0)",
    "sidebarForeground": "oklch(0.2077 0.0398 265.7549)",
    "sidebarPrimary": "oklch(0.8871 0.2122 128.5041)",
    "sidebarPrimaryForeground": "oklch(0 0 0)",
    "sidebarAccent": "oklch(0.9842 0.0034 247.8575)",
    "sidebarAccentForeground": "oklch(0.2077 0.0398 265.7549)",
    "sidebarBorder": "oklch(0.9683 0.0069 247.8956)",
    "sidebarRing": "oklch(0.8871 0.2122 128.5041)",
    "chart1": "oklch(0.8871 0.2122 128.5041)",
    "chart2": "oklch(0.3717 0.0392 257.2870)",
    "chart3": "oklch(0.7227 0.1920 149.5793)",
    "chart4": "oklch(0.5544 0.0407 257.4166)",
    "chart5": "oklch(0.7107 0.0351 256.7878)"
  },
  "dark": {
    "background": "oklch(0.1288 0.0406 264.6952)",
    "foreground": "oklch(0.9842 0.0034 247.8575)",
    "card": "oklch(0.2077 0.0398 265.7549)",
    "cardForeground": "oklch(0.9842 0.0034 247.8575)",
    "popover": "oklch(0.2077 0.0398 265.7549)",
    "popoverForeground": "oklch(0.9842 0.0034 247.8575)",
    "primary": "oklch(0.8871 0.2122 128.5041)",
    "primaryForeground": "oklch(0 0 0)",
    "secondary": "oklch(0.2795 0.0368 260.0310)",
    "secondaryForeground": "oklch(0.9842 0.0034 247.8575)",
    "muted": "oklch(0.2795 0.0368 260.0310)",
    "mutedForeground": "oklch(0.7107 0.0351 256.7878)",
    "accent": "oklch(0.3925 0.0896 152.5353)",
    "accentForeground": "oklch(0.8871 0.2122 128.5041)",
    "destructive": "oklch(0.4437 0.1613 26.8994)",
    "destructiveForeground": "oklch(1.0000 0 0)",
    "border": "oklch(0.2795 0.0368 260.0310)",
    "input": "oklch(0.2795 0.0368 260.0310)",
    "ring": "oklch(0.8871 0.2122 128.5041)",
    "radius": "1rem",
    "sidebarBackground": "oklch(0.1288 0.0406 264.6952)",
    "sidebarForeground": "oklch(0.9842 0.0034 247.8575)",
    "sidebarPrimary": "oklch(0.8871 0.2122 128.5041)",
    "sidebarPrimaryForeground": "oklch(0 0 0)",
    "sidebarAccent": "oklch(0.2795 0.0368 260.0310)",
    "sidebarAccentForeground": "oklch(0.9842 0.0034 247.8575)",
    "sidebarBorder": "oklch(0.2795 0.0368 260.0310)",
    "sidebarRing": "oklch(0.8871 0.2122 128.5041)",
    "chart1": "oklch(0.8871 0.2122 128.5041)",
    "chart2": "oklch(0.6231 0.1880 259.8145)",
    "chart3": "oklch(0.7227 0.1920 149.5793)",
    "chart4": "oklch(0.6268 0.2325 303.9004)",
    "chart5": "oklch(0.7686 0.1647 70.0804)"
  }
}
