{
  "version": 1,
  "name": "starry-night",
  "label": "Starry Night",
  "description": "Painterly night blues with gold accents (Libre Baskerville).",
  "recommended": true,
  "radius": "0.5rem",
  "fonts": {
    "sans": "Libre Baskerville, serif",
    "serif": "ui-serif, Georgia, Cambria, \"Times New Roman\", Times, serif",
    "mono": "ui-monospace, SFMono-Regular, Menlo, Monaco, Consolas, \"Liberation Mono\", \"Courier New\", monospace",
    "files": [
      "https://fonts.googleapis.com/css2?family=Libre+Baskerville:ital,wght@0,400..700;1,400..700&display=swap"
    ]
  },
  "light": {
    "background": "oklch(0.9755 0.0045 258.3245)",
    "foreground": "oklch(0.2558 0.0433 268.0662)",
    "card": "oklch(0.9341 0.0132 251.5628)",
    "cardForeground": "oklch(0.2558 0.0433 268.0662)",
    "popover": "oklch(0.9856 0.0278 98.0540)",
    "popoverForeground": "oklch(0.2558 0.0433 268.0662)",
    "primary": "oklch(0.4815 0.1178 263.3758)",
    "primaryForeground": "oklch(0.9856 0.0278 98.0540)",
    "secondary": "oklch(0.8567 0.1164 81.0092)",
    "secondaryForeground": "oklch(0.2558 0.0433 268.0662)",
    "muted": "oklch(0.9202 0.0080 106.5563)",
    "mutedForeground": "oklch(0.4815 0.1178 263.3758)",
    "accent": "oklch(0.6896 0.0714 234.0387)",
    "accentForeground": "oklch(0.9856 0.0278 98.0540)",
    "destructive": "oklch(0.2611 0.0376 322.5267)",
    "destructiveForeground": "oklch(0.9856 0.0278 98.0540)",
    "border": "oklch(0.7791 0.0156 251.1926)",
    "input": "oklch(0.6896 0.0714 234.0387)",
    "ring": "oklch(0.8567 0.1164 81.0092)",
    "chart1": "oklch(0.4815 0.1178 263.3758)",
    "chart2": "oklch(0.8567 0.1164 81.0092)",
    "chart3": "oklch(0.6896 0.0714 234.0387)",
    "chart4": "oklch(0.7791 0.0156 251.1926)",
    "chart5": "oklch(0.2611 0.0376 322.5267)",
    "radius": "0.5rem",
    "sidebarBackground": "oklch(0.9341 0.0132 251.5628)",
    "sidebarForeground": "oklch(0.2558 0.0433 268.0662)",
    "sidebarPrimary": "oklch(0.4815 0.1178 263.3758)",
    "sidebarPrimaryForeground": "oklch(0.9856 0.0278 98.0540)",
    "sidebarAccent": "oklch(0.8567 0.1164 81.0092)",
    "sidebarAccentForeground": "oklch(0.2558 0.0433 268.0662)",
    "sidebarBorder": "oklch(0.7791 0.0156 251.1926)",
    "sidebarRing": "oklch(0.8567 0.1164 81.0092)"
  },
  "dark": {
    "background": "oklch(0.2204 0.0198 275.8439)",
    "foreground": "oklch(0.9366 0.0129 266.6974)",
    "card": "oklch(0.2703 0.0407 281.3036)",
    "cardForeground": "oklch(0.9366 0.0129 266.6974)",
    "popover": "oklch(0.2703 0.0407 281.3036)",
    "popoverForeground": "oklch(0.9097 0.1440 95.1120)",
    "primary": "oklch(0.4815 0.1178 263.3758)",
    "primaryForeground": "oklch(0.9097 0.1440 95.1120)",
    "secondary": "oklch(0.9097 0.1440 95.1120)",
    "secondaryForeground": "oklch(0.2703 0.0407 281.3036)",
    "muted": "oklch(0.2424 0.0324 281.0890)",
    "mutedForeground": "oklch(0.6243 0.0412 262.0375)",
    "accent": "oklch(0.8469 0.0524 264.7751)",
    "accentForeground": "oklch(0.2204 0.0198 275.8439)",
    "destructive": "oklch(0.5280 0.1200 357.1130)",
    "destructiveForeground": "oklch(0.9097 0.1440 95.1120)",
    "border": "oklch(0.3072 0.0287 281.7681)",
    "input": "oklch(0.4815 0.1178 263.3758)",
    "ring": "oklch(0.9097 0.1440 95.1120)",
    "chart1": "oklch(0.4815 0.1178 263.3758)",
    "chart2": "oklch(0.9097 0.1440 95.1120)",
    "chart3": "oklch(0.6896 0.0714 234.0387)",
    "chart4": "oklch(0.6243 0.0412 262.0375)",
    "chart5": "oklch(0.5280 0.1200 357.1130)",
    "radius": "0.5rem",
    "sidebarBackground": "oklch(0.2703 0.0407 281.3036)",
    "sidebarForeground": "oklch(0.9366 0.0129 266.6974)",
    "sidebarPrimary": "oklch(0.4815 0.1178 263.3758)",
    "sidebarPrimaryForeground": "oklch(0.9097 0.1440 95.1120)",
    "sidebarAccent": "oklch(0.9097 0.1440 95.1120)",
    "sidebarAccentForeground": "oklch(0.2703 0.0407 281.3036)",
    "sidebarBorder": "oklch(0.3072 0.0287 281.7681)",
    "sidebarRing": "oklch(0.9097 0.1440 95.1120)"
  }
}
