{
  "version": 1,
  "name": "claymorphism",
  "label": "Claymorphism",
  "description": "Soft clay surfaces with violet primary (Plus Jakarta Sans + Lora + Roboto Mono).",
  "recommended": true,
  "radius": "1.25rem",
  "fonts": {
    "sans": "Plus Jakarta Sans, sans-serif",
    "serif": "Lora, serif",
    "mono": "Roboto Mono, monospace",
    "files": [
      "https://fonts.googleapis.com/css2?family=Lora:ital,wght@0,400..700;1,400..700&family=Plus+Jakarta+Sans:ital,wght@0,200..800;1,200..800&family=Roboto+Mono:ital,wght@0,100..700;1,100..700&display=swap"
    ]
  },
  "light": {
    "background": "oklch(0.9232 0.0026 48.7171)",
    "foreground": "oklch(0.2795 0.0368 260.0310)",
    "card": "oklch(0.9699 0.0013 106.4238)",
    "cardForeground": "oklch(0.2795 0.0368 260.0310)",
    "popover": "oklch(0.9699 0.0013 106.4238)",
    "popoverForeground": "oklch(0.2795 0.0368 260.0310)",
    "primary": "oklch(0.5854 0.2041 277.1173)",
    "primaryForeground": "oklch(1.0000 0 0)",
    "secondary": "oklch(0.8687 0.0043 56.3660)",
    "secondaryForeground": "oklch(0.4461 0.0263 256.8018)",
    "muted": "oklch(0.9232 0.0026 48.7171)",
    "mutedForeground": "oklch(0.5510 0.0234 264.3637)",
    "accent": "oklch(0.9376 0.0260 321.9388)",
    "accentForeground": "oklch(0.3729 0.0306 259.7328)",
    "destructive": "oklch(0.6368 0.2078 25.3313)",
    "destructiveForeground": "oklch(1.0000 0 0)",
    "border": "oklch(0.8687 0.0043 56.3660)",
    "input": "oklch(0.8687 0.0043 56.3660)",
    "ring": "oklch(0.5854 0.2041 277.1173)",
    "radius": "1.25rem",
    "sidebarBackground": "oklch(0.8687 0.0043 56.3660)",
    "sidebarForeground": "oklch(0.2795 0.0368 260.0310)",
    "sidebarPrimary": "oklch(0.5854 0.2041 277.1173)",
    "sidebarPrimaryForeground": "oklch(1.0000 0 0)",
    "sidebarAccent": "oklch(0.9376 0.0260 321.9388)",
    "sidebarAccentForeground": "oklch(0.3729 0.0306 259.7328)",
    "sidebarBorder": "oklch(0.8687 0.0043 56.3660)",
    "sidebarRing": "oklch(0.5854 0.2041 277.1173)",
    "chart1": "oklch(0.5854 0.2041 277.1173)",
    "chart2": "oklch(0.5106 0.2301 276.9656)",
    "chart3": "oklch(0.4568 0.2146 277.0229)",
    "chart4": "oklch(0.3984 0.1773 277.3662)",
    "chart5": "oklch(0.3588 0.1354 278.6973)"
  },
  "dark": {
    "background": "oklch(0.2244 0.0074 67.4370)",
    "foreground": "oklch(0.9288 0.0126 255.5078)",
    "card": "oklch(0.2801 0.0080 59.3379)",
    "cardForeground": "oklch(0.9288 0.0126 255.5078)",
    "popover": "oklch(0.2801 0.0080 59.3379)",
    "popoverForeground": "oklch(0.9288 0.0126 255.5078)",
    "primary": "oklch(0.6801 0.1583 276.9349)",
    "primaryForeground": "oklch(0.2244 0.0074 67.4370)",
    "secondary": "oklch(0.3359 0.0077 59.4197)",
    "secondaryForeground": "oklch(0.8717 0.0093 258.3382)",
    "muted": "oklch(0.2287 0.0074 67.4469)",
    "mutedForeground": "oklch(0.7137 0.0192 261.3246)",
    "accent": "oklch(0.3896 0.0074 59.4734)",
    "accentForeground": "oklch(0.8717 0.0093 258.3382)",
    "destructive": "oklch(0.6368 0.2078 25.3313)",
    "destructiveForeground": "oklch(0.2244 0.0074 67.4370)",
    "border": "oklch(0.3359 0.0077 59.4197)",
    "input": "oklch(0.3359 0.0077 59.4197)",
    "ring": "oklch(0.6801 0.1583 276.9349)",
    "radius": "1.25rem",
    "sidebarBackground": "oklch(0.3359 0.0077 59.4197)",
    "sidebarForeground": "oklch(0.9288 0.0126 255.5078)",
    "sidebarPrimary": "oklch(0.6801 0.1583 276.9349)",
    "sidebarPrimaryForeground": "oklch(0.2244 0.0074 67.4370)",
    "sidebarAccent": "oklch(0.3896 0.0074 59.4734)",
    "sidebarAccentForeground": "oklch(0.8717 0.0093 258.3382)",
    "sidebarBorder": "oklch(0.3359 0.0077 59.4197)",
    "sidebarRing": "oklch(0.6801 0.1583 276.9349)",
    "chart1": "oklch(0.6801 0.1583 276.9349)",
    "chart2": "oklch(0.5854 0.2041 277.1173)",
    "chart3": "oklch(0.5106 0.2301 276.9656)",
    "chart4": "oklch(0.4568 0.2146 277.0229)",
    "chart5": "oklch(0.3984 0.1773 277.3662)"
  }
}
