{
  "version": 1,
  "name": "elegant-luxury",
  "label": "Elegant Luxury",
  "description": "Warm burgundy luxury palette (Poppins + Libre Baskerville + IBM Plex Mono).",
  "recommended": true,
  "radius": "0.375rem",
  "fonts": {
    "sans": "Poppins, sans-serif",
    "serif": "Libre Baskerville, serif",
    "mono": "IBM Plex Mono, monospace",
    "files": [
      "https://fonts.googleapis.com/css2?family=IBM+Plex+Mono:ital,wght@0,100..700;1,100..700&family=Libre+Baskerville:ital,wght@0,400..700;1,400..700&family=Poppins:ital,wght@0,100..900;1,100..900&display=swap"
    ]
  },
  "light": {
    "background": "oklch(0.9779 0.0042 56.3756)",
    "foreground": "oklch(0.2178 0 0)",
    "card": "oklch(0.9779 0.0042 56.3756)",
    "cardForeground": "oklch(0.2178 0 0)",
    "popover": "oklch(0.9779 0.0042 56.3756)",
    "popoverForeground": "oklch(0.2178 0 0)",
    "primary": "oklch(0.4650 0.1470 24.9381)",
    "primaryForeground": "oklch(1.0000 0 0)",
    "secondary": "oklch(0.9625 0.0385 89.0943)",
    "secondaryForeground": "oklch(0.4847 0.1022 75.1153)",
    "muted": "oklch(0.9431 0.0068 53.4442)",
    "mutedForeground": "oklch(0.4444 0.0096 73.6390)",
    "accent": "oklch(0.9619 0.0580 95.6174)",
    "accentForeground": "oklch(0.3958 0.1331 25.7230)",
    "destructive": "oklch(0.4437 0.1613 26.8994)",
    "destructiveForeground": "oklch(1.0000 0 0)",
    "border": "oklch(0.9355 0.0324 80.9937)",
    "input": "oklch(0.9355 0.0324 80.9937)",
    "ring": "oklch(0.4650 0.1470 24.9381)",
    "chart1": "oklch(0.5054 0.1905 27.5181)",
    "chart2": "oklch(0.4650 0.1470 24.9381)",
    "chart3": "oklch(0.3958 0.1331 25.7230)",
    "chart4": "oklch(0.5553 0.1455 48.9975)",
    "chart5": "oklch(0.4732 0.1247 46.2007)",
    "radius": "0.375rem",
    "sidebarBackground": "oklch(0.9431 0.0068 53.4442)",
    "sidebarForeground": "oklch(0.2178 0 0)",
    "sidebarPrimary": "oklch(0.4650 0.1470 24.9381)",
    "sidebarPrimaryForeground": "oklch(1.0000 0 0)",
    "sidebarAccent": "oklch(0.9619 0.0580 95.6174)",
    "sidebarAccentForeground": "oklch(0.3958 0.1331 25.7230)",
    "sidebarBorder": "oklch(0.9355 0.0324 80.9937)",
    "sidebarRing": "oklch(0.4650 0.1470 24.9381)"
  },
  "dark": {
    "background": "oklch(0.2161 0.0061 56.0434)",
    "foreground": "oklch(0.9699 0.0013 106.4238)",
    "card": "oklch(0.2685 0.0063 34.2976)",
    "cardForeground": "oklch(0.9699 0.0013 106.4238)",
    "popover": "oklch(0.2685 0.0063 34.2976)",
    "popoverForeground": "oklch(0.9699 0.0013 106.4238)",
    "primary": "oklch(0.5054 0.1905 27.5181)",
    "primaryForeground": "oklch(0.9779 0.0042 56.3756)",
    "secondary": "oklch(0.4732 0.1247 46.2007)",
    "secondaryForeground": "oklch(0.9619 0.0580 95.6174)",
    "muted": "oklch(0.2291 0.0060 56.0708)",
    "mutedForeground": "oklch(0.8687 0.0043 56.3660)",
    "accent": "oklch(0.5553 0.1455 48.9975)",
    "accentForeground": "oklch(0.9619 0.0580 95.6174)",
    "destructive": "oklch(0.6368 0.2078 25.3313)",
    "destructiveForeground": "oklch(1.0000 0 0)",
    "border": "oklch(0.3741 0.0087 67.5582)",
    "input": "oklch(0.3741 0.0087 67.5582)",
    "ring": "oklch(0.5054 0.1905 27.5181)",
    "chart1": "oklch(0.7106 0.1661 22.2162)",
    "chart2": "oklch(0.6368 0.2078 25.3313)",
    "chart3": "oklch(0.5771 0.2152 27.3250)",
    "chart4": "oklch(0.8369 0.1644 84.4286)",
    "chart5": "oklch(0.7686 0.1647 70.0804)",
    "radius": "0.375rem",
    "sidebarBackground": "oklch(0.2161 0.0061 56.0434)",
    "sidebarForeground": "oklch(0.9699 0.0013 106.4238)",
    "sidebarPrimary": "oklch(0.5054 0.1905 27.5181)",
    "sidebarPrimaryForeground": "oklch(0.9779 0.0042 56.3756)",
    "sidebarAccent": "oklch(0.5553 0.1455 48.9975)",
    "sidebarAccentForeground": "oklch(0.9619 0.0580 95.6174)",
    "sidebarBorder": "oklch(0.3741 0.0087 67.5582)",
    "sidebarRing": "oklch(0.5054 0.1905 27.5181)"
  }
}
