{
  "version": 1,
  "name": "sunset-horizon",
  "label": "Sunset Horizon",
  "description": "Warm sunset oranges (Montserrat + Merriweather + Ubuntu Mono).",
  "recommended": true,
  "radius": "0.625rem",
  "fonts": {
    "sans": "Montserrat, sans-serif",
    "serif": "Merriweather, serif",
    "mono": "Ubuntu Mono, monospace",
    "files": [
      "https://fonts.googleapis.com/css2?family=Merriweather:ital,wght@0,300..900;1,300..900&family=Montserrat:ital,wght@0,100..900;1,100..900&family=Ubuntu+Mono:ital,wght@0,400;0,700;1,400;1,700&display=swap"
    ]
  },
  "light": {
    "background": "oklch(0.9856 0.0084 56.3169)",
    "foreground": "oklch(0.3353 0.0132 2.7676)",
    "card": "oklch(1.0000 0 0)",
    "cardForeground": "oklch(0.3353 0.0132 2.7676)",
    "popover": "oklch(1.0000 0 0)",
    "popoverForeground": "oklch(0.3353 0.0132 2.7676)",
    "primary": "oklch(0.7357 0.1641 34.7091)",
    "primaryForeground": "oklch(1.0000 0 0)",
    "secondary": "oklch(0.9596 0.0200 28.9029)",
    "secondaryForeground": "oklch(0.5587 0.1294 32.7364)",
    "muted": "oklch(0.9656 0.0176 39.4009)",
    "mutedForeground": "oklch(0.5534 0.0116 58.0708)",
    "accent": "oklch(0.8278 0.1131 57.9984)",
    "accentForeground": "oklch(0.3353 0.0132 2.7676)",
    "destructive": "oklch(0.6122 0.2082 22.2410)",
    "destructiveForeground": "oklch(1.0000 0 0)",
    "border": "oklch(0.9296 0.0370 38.6868)",
    "input": "oklch(0.9296 0.0370 38.6868)",
    "ring": "oklch(0.7357 0.1641 34.7091)",
    "chart1": "oklch(0.7357 0.1641 34.7091)",
    "chart2": "oklch(0.8278 0.1131 57.9984)",
    "chart3": "oklch(0.8773 0.0763 54.9314)",
    "chart4": "oklch(0.8200 0.1054 40.8859)",
    "chart5": "oklch(0.6368 0.1306 32.0721)",
    "radius": "0.625rem",
    "sidebarBackground": "oklch(0.9656 0.0176 39.4009)",
    "sidebarForeground": "oklch(0.3353 0.0132 2.7676)",
    "sidebarPrimary": "oklch(0.7357 0.1641 34.7091)",
    "sidebarPrimaryForeground": "oklch(1.0000 0 0)",
    "sidebarAccent": "oklch(0.8278 0.1131 57.9984)",
    "sidebarAccentForeground": "oklch(0.3353 0.0132 2.7676)",
    "sidebarBorder": "oklch(0.9296 0.0370 38.6868)",
    "sidebarRing": "oklch(0.7357 0.1641 34.7091)"
  },
  "dark": {
    "background": "oklch(0.2569 0.0169 352.4042)",
    "foreground": "oklch(0.9397 0.0119 51.3156)",
    "card": "oklch(0.3184 0.0176 341.4465)",
    "cardForeground": "oklch(0.9397 0.0119 51.3156)",
    "popover": "oklch(0.3184 0.0176 341.4465)",
    "popoverForeground": "oklch(0.9397 0.0119 51.3156)",
    "primary": "oklch(0.7357 0.1641 34.7091)",
    "primaryForeground": "oklch(1.0000 0 0)",
    "secondary": "oklch(0.3637 0.0203 342.2664)",
    "secondaryForeground": "oklch(0.9397 0.0119 51.3156)",
    "muted": "oklch(0.2848 0.0159 343.6554)",
    "mutedForeground": "oklch(0.8378 0.0237 52.6346)",
    "accent": "oklch(0.8278 0.1131 57.9984)",
    "accentForeground": "oklch(0.2569 0.0169 352.4042)",
    "destructive": "oklch(0.6122 0.2082 22.2410)",
    "destructiveForeground": "oklch(1.0000 0 0)",
    "border": "oklch(0.3637 0.0203 342.2664)",
    "input": "oklch(0.3637 0.0203 342.2664)",
    "ring": "oklch(0.7357 0.1641 34.7091)",
    "chart1": "oklch(0.7357 0.1641 34.7091)",
    "chart2": "oklch(0.8278 0.1131 57.9984)",
    "chart3": "oklch(0.8773 0.0763 54.9314)",
    "chart4": "oklch(0.8200 0.1054 40.8859)",
    "chart5": "oklch(0.6368 0.1306 32.0721)",
    "radius": "0.625rem",
    "sidebarBackground": "oklch(0.2569 0.0169 352.4042)",
    "sidebarForeground": "oklch(0.9397 0.0119 51.3156)",
    "sidebarPrimary": "oklch(0.7357 0.1641 34.7091)",
    "sidebarPrimaryForeground": "oklch(1.0000 0 0)",
    "sidebarAccent": "oklch(0.8278 0.1131 57.9984)",
    "sidebarAccentForeground": "oklch(0.2569 0.0169 352.4042)",
    "sidebarBorder": "oklch(0.3637 0.0203 342.2664)",
    "sidebarRing": "oklch(0.7357 0.1641 34.7091)"
  }
}
