{
  "version": 1,
  "name": "candyland",
  "label": "Candyland",
  "description": "Soft pastel pink, blue, and lime accents (Poppins + Roboto Mono).",
  "recommended": true,
  "radius": "0.5rem",
  "fonts": {
    "sans": "Poppins, sans-serif",
    "serif": "ui-serif, Georgia, Cambria, \"Times New Roman\", Times, serif",
    "mono": "Roboto Mono, monospace",
    "files": [
      "https://fonts.googleapis.com/css2?family=Poppins:ital,wght@0,100..900;1,100..900&family=Roboto+Mono:ital,wght@0,100..700;1,100..700&display=swap"
    ]
  },
  "light": {
    "background": "oklch(0.9809 0.0025 228.7836)",
    "foreground": "oklch(0.3211 0 0)",
    "card": "oklch(1.0000 0 0)",
    "cardForeground": "oklch(0.3211 0 0)",
    "popover": "oklch(1.0000 0 0)",
    "popoverForeground": "oklch(0.3211 0 0)",
    "primary": "oklch(0.8677 0.0735 7.0855)",
    "primaryForeground": "oklch(0 0 0)",
    "secondary": "oklch(0.8148 0.0819 225.7537)",
    "secondaryForeground": "oklch(0 0 0)",
    "muted": "oklch(0.8828 0.0285 98.1033)",
    "mutedForeground": "oklch(0.5382 0 0)",
    "accent": "oklch(0.9680 0.2110 109.7692)",
    "accentForeground": "oklch(0 0 0)",
    "destructive": "oklch(0.6368 0.2078 25.3313)",
    "destructiveForeground": "oklch(1.0000 0 0)",
    "border": "oklch(0.8699 0 0)",
    "input": "oklch(0.8699 0 0)",
    "ring": "oklch(0.8677 0.0735 7.0855)",
    "radius": "0.5rem",
    "sidebarBackground": "oklch(0.9809 0.0025 228.7836)",
    "sidebarForeground": "oklch(0.3211 0 0)",
    "sidebarPrimary": "oklch(0.8677 0.0735 7.0855)",
    "sidebarPrimaryForeground": "oklch(0 0 0)",
    "sidebarAccent": "oklch(0.9680 0.2110 109.7692)",
    "sidebarAccentForeground": "oklch(0 0 0)",
    "sidebarBorder": "oklch(0.8699 0 0)",
    "sidebarRing": "oklch(0.8677 0.0735 7.0855)",
    "chart1": "oklch(0.8677 0.0735 7.0855)",
    "chart2": "oklch(0.8148 0.0819 225.7537)",
    "chart3": "oklch(0.9680 0.2110 109.7692)",
    "chart4": "oklch(0.8027 0.1355 349.2347)",
    "chart5": "oklch(0.7395 0.2268 142.8504)"
  },
  "dark": {
    "background": "oklch(0.2303 0.0125 264.2926)",
    "foreground": "oklch(0.9219 0 0)",
    "card": "oklch(0.3210 0.0078 223.6661)",
    "cardForeground": "oklch(0.9219 0 0)",
    "popover": "oklch(0.3210 0.0078 223.6661)",
    "popoverForeground": "oklch(0.9219 0 0)",
    "primary": "oklch(0.8027 0.1355 349.2347)",
    "primaryForeground": "oklch(0 0 0)",
    "secondary": "oklch(0.7395 0.2268 142.8504)",
    "secondaryForeground": "oklch(0 0 0)",
    "muted": "oklch(0.3867 0 0)",
    "mutedForeground": "oklch(0.7155 0 0)",
    "accent": "oklch(0.8148 0.0819 225.7537)",
    "accentForeground": "oklch(0 0 0)",
    "destructive": "oklch(0.6368 0.2078 25.3313)",
    "destructiveForeground": "oklch(1.0000 0 0)",
    "border": "oklch(0.3867 0 0)",
    "input": "oklch(0.3867 0 0)",
    "ring": "oklch(0.8027 0.1355 349.2347)",
    "radius": "0.5rem",
    "sidebarBackground": "oklch(0.2303 0.0125 264.2926)",
    "sidebarForeground": "oklch(0.9219 0 0)",
    "sidebarPrimary": "oklch(0.8027 0.1355 349.2347)",
    "sidebarPrimaryForeground": "oklch(0 0 0)",
    "sidebarAccent": "oklch(0.8148 0.0819 225.7537)",
    "sidebarAccentForeground": "oklch(0 0 0)",
    "sidebarBorder": "oklch(0.3867 0 0)",
    "sidebarRing": "oklch(0.8027 0.1355 349.2347)",
    "chart1": "oklch(0.8027 0.1355 349.2347)",
    "chart2": "oklch(0.7395 0.2268 142.8504)",
    "chart3": "oklch(0.8148 0.0819 225.7537)",
    "chart4": "oklch(0.9680 0.2110 109.7692)",
    "chart5": "oklch(0.8652 0.1768 90.3816)"
  }
}
