{
  "version": 1,
  "name": "shadcn",
  "label": "shadcn",
  "description": "Default shadcn/ui neutral palette with system fonts.",
  "recommended": true,
  "radius": "0.625rem",
  "fonts": {
    "sans": "ui-sans-serif, system-ui, -apple-system, BlinkMacSystemFont, 'Segoe UI', Roboto, 'Helvetica Neue', Arial, 'Noto Sans', sans-serif, 'Apple Color Emoji', 'Segoe UI Emoji', 'Segoe UI Symbol', 'Noto Color Emoji'",
    "serif": "ui-serif, Georgia, Cambria, \"Times New Roman\", Times, serif",
    "mono": "ui-monospace, SFMono-Regular, Menlo, Monaco, Consolas, \"Liberation Mono\", \"Courier New\", monospace"
  },
  "light": {
    "background": "oklch(1 0 0)",
    "foreground": "oklch(0.1450 0 0)",
    "card": "oklch(1 0 0)",
    "cardForeground": "oklch(0.1450 0 0)",
    "popover": "oklch(1 0 0)",
    "popoverForeground": "oklch(0.1450 0 0)",
    "primary": "oklch(0.2050 0 0)",
    "primaryForeground": "oklch(0.9850 0 0)",
    "secondary": "oklch(0.9700 0 0)",
    "secondaryForeground": "oklch(0.2050 0 0)",
    "muted": "oklch(0.9700 0 0)",
    "mutedForeground": "oklch(0.5560 0 0)",
    "accent": "oklch(0.9700 0 0)",
    "accentForeground": "oklch(0.2050 0 0)",
    "destructive": "oklch(0.5770 0.2450 27.3250)",
    "destructiveForeground": "oklch(1 0 0)",
    "border": "oklch(0.9220 0 0)",
    "input": "oklch(0.9220 0 0)",
    "ring": "oklch(0.7080 0 0)",
    "radius": "0.625rem",
    "sidebarBackground": "oklch(0.9850 0 0)",
    "sidebarForeground": "oklch(0.1450 0 0)",
    "sidebarPrimary": "oklch(0.2050 0 0)",
    "sidebarPrimaryForeground": "oklch(0.9850 0 0)",
    "sidebarAccent": "oklch(0.9700 0 0)",
    "sidebarAccentForeground": "oklch(0.2050 0 0)",
    "sidebarBorder": "oklch(0.9220 0 0)",
    "sidebarRing": "oklch(0.7080 0 0)",
    "chart1": "oklch(0.8100 0.1000 252)",
    "chart2": "oklch(0.6200 0.1900 260)",
    "chart3": "oklch(0.5500 0.2200 263)",
    "chart4": "oklch(0.4900 0.2200 264)",
    "chart5": "oklch(0.4200 0.1800 266)"
  },
  "dark": {
    "background": "oklch(0.1450 0 0)",
    "foreground": "oklch(0.9850 0 0)",
    "card": "oklch(0.2050 0 0)",
    "cardForeground": "oklch(0.9850 0 0)",
    "popover": "oklch(0.2690 0 0)",
    "popoverForeground": "oklch(0.9850 0 0)",
    "primary": "oklch(0.9220 0 0)",
    "primaryForeground": "oklch(0.2050 0 0)",
    "secondary": "oklch(0.2690 0 0)",
    "secondaryForeground": "oklch(0.9850 0 0)",
    "muted": "oklch(0.2690 0 0)",
    "mutedForeground": "oklch(0.7080 0 0)",
    "accent": "oklch(0.3710 0 0)",
    "accentForeground": "oklch(0.9850 0 0)",
    "destructive": "oklch(0.7040 0.1910 22.2160)",
    "destructiveForeground": "oklch(0.9850 0 0)",
    "border": "oklch(0.2750 0 0)",
    "input": "oklch(0.3250 0 0)",
    "ring": "oklch(0.5560 0 0)",
    "radius": "0.625rem",
    "sidebarBackground": "oklch(0.2050 0 0)",
    "sidebarForeground": "oklch(0.9850 0 0)",
    "sidebarPrimary": "oklch(0.4880 0.2430 264.3760)",
    "sidebarPrimaryForeground": "oklch(0.9850 0 0)",
    "sidebarAccent": "oklch(0.2690 0 0)",
    "sidebarAccentForeground": "oklch(0.9850 0 0)",
    "sidebarBorder": "oklch(0.2750 0 0)",
    "sidebarRing": "oklch(0.4390 0 0)",
    "chart1": "oklch(0.8100 0.1000 252)",
    "chart2": "oklch(0.6200 0.1900 260)",
    "chart3": "oklch(0.5500 0.2200 263)",
    "chart4": "oklch(0.4900 0.2200 264)",
    "chart5": "oklch(0.4200 0.1800 266)"
  }
}
