{
  "version": 1,
  "name": "soft-pop",
  "label": "Soft Pop",
  "description": "Playful violet and teal soft-pop accents (DM Sans + Space Mono).",
  "recommended": true,
  "radius": "1rem",
  "fonts": {
    "sans": "DM Sans, sans-serif",
    "serif": "DM Sans, sans-serif",
    "mono": "Space Mono, monospace",
    "files": [
      "https://fonts.googleapis.com/css2?family=DM+Sans:ital,opsz,wght@0,9..40,100..1000;1,9..40,100..1000&family=Space+Mono:ital,wght@0,400;0,700;1,400;1,700&display=swap"
    ]
  },
  "light": {
    "background": "oklch(0.9789 0.0082 121.6272)",
    "foreground": "oklch(0 0 0)",
    "card": "oklch(1.0000 0 0)",
    "cardForeground": "oklch(0 0 0)",
    "popover": "oklch(1.0000 0 0)",
    "popoverForeground": "oklch(0 0 0)",
    "primary": "oklch(0.5106 0.2301 276.9656)",
    "primaryForeground": "oklch(1.0000 0 0)",
    "secondary": "oklch(0.7038 0.1230 182.5025)",
    "secondaryForeground": "oklch(1.0000 0 0)",
    "muted": "oklch(0.9551 0 0)",
    "mutedForeground": "oklch(0.3211 0 0)",
    "accent": "oklch(0.7686 0.1647 70.0804)",
    "accentForeground": "oklch(0 0 0)",
    "destructive": "oklch(0.6368 0.2078 25.3313)",
    "destructiveForeground": "oklch(1.0000 0 0)",
    "border": "oklch(0 0 0)",
    "input": "oklch(0.5555 0 0)",
    "ring": "oklch(0.7853 0.1041 274.7134)",
    "chart1": "oklch(0.5106 0.2301 276.9656)",
    "chart2": "oklch(0.7038 0.1230 182.5025)",
    "chart3": "oklch(0.7686 0.1647 70.0804)",
    "chart4": "oklch(0.6559 0.2118 354.3084)",
    "chart5": "oklch(0.7227 0.1920 149.5793)",
    "radius": "1rem",
    "sidebarBackground": "oklch(0.9789 0.0082 121.6272)",
    "sidebarForeground": "oklch(0 0 0)",
    "sidebarPrimary": "oklch(0.5106 0.2301 276.9656)",
    "sidebarPrimaryForeground": "oklch(1.0000 0 0)",
    "sidebarAccent": "oklch(0.7686 0.1647 70.0804)",
    "sidebarAccentForeground": "oklch(0 0 0)",
    "sidebarBorder": "oklch(0 0 0)",
    "sidebarRing": "oklch(0.7853 0.1041 274.7134)"
  },
  "dark": {
    "background": "oklch(0 0 0)",
    "foreground": "oklch(1.0000 0 0)",
    "card": "oklch(0.2455 0.0217 257.2823)",
    "cardForeground": "oklch(1.0000 0 0)",
    "popover": "oklch(0.2455 0.0217 257.2823)",
    "popoverForeground": "oklch(1.0000 0 0)",
    "primary": "oklch(0.6801 0.1583 276.9349)",
    "primaryForeground": "oklch(0 0 0)",
    "secondary": "oklch(0.7845 0.1325 181.9120)",
    "secondaryForeground": "oklch(0 0 0)",
    "muted": "oklch(0.3211 0 0)",
    "mutedForeground": "oklch(0.8452 0 0)",
    "accent": "oklch(0.8790 0.1534 91.6054)",
    "accentForeground": "oklch(0 0 0)",
    "destructive": "oklch(0.7106 0.1661 22.2162)",
    "destructiveForeground": "oklch(0 0 0)",
    "border": "oklch(0.4459 0 0)",
    "input": "oklch(1.0000 0 0)",
    "ring": "oklch(0.6801 0.1583 276.9349)",
    "chart1": "oklch(0.6801 0.1583 276.9349)",
    "chart2": "oklch(0.7845 0.1325 181.9120)",
    "chart3": "oklch(0.8790 0.1534 91.6054)",
    "chart4": "oklch(0.7253 0.1752 349.7607)",
    "chart5": "oklch(0.8003 0.1821 151.7110)",
    "radius": "1rem",
    "sidebarBackground": "oklch(0 0 0)",
    "sidebarForeground": "oklch(1.0000 0 0)",
    "sidebarPrimary": "oklch(0.6801 0.1583 276.9349)",
    "sidebarPrimaryForeground": "oklch(0 0 0)",
    "sidebarAccent": "oklch(0.8790 0.1534 91.6054)",
    "sidebarAccentForeground": "oklch(0 0 0)",
    "sidebarBorder": "oklch(1.0000 0 0)",
    "sidebarRing": "oklch(0.6801 0.1583 276.9349)"
  }
}
