{
  "version": 1,
  "name": "midnight-bloom",
  "label": "Midnight Bloom",
  "description": "Violet bloom accents (Montserrat + Playfair Display + Source Code Pro).",
  "recommended": true,
  "radius": "0.5rem",
  "fonts": {
    "sans": "Montserrat, sans-serif",
    "serif": "Playfair Display, serif",
    "mono": "Source Code Pro, monospace",
    "files": [
      "https://fonts.googleapis.com/css2?family=Montserrat:ital,wght@0,100..900;1,100..900&family=Playfair+Display:ital,wght@0,400..900;1,400..900&family=Source+Code+Pro:ital,wght@0,200..900;1,200..900&display=swap"
    ]
  },
  "light": {
    "background": "oklch(0.9821 0 0)",
    "foreground": "oklch(0.3211 0 0)",
    "card": "oklch(1.0000 0 0)",
    "cardForeground": "oklch(0.3211 0 0)",
    "popover": "oklch(1.0000 0 0)",
    "popoverForeground": "oklch(0.3211 0 0)",
    "primary": "oklch(0.5676 0.2021 283.0838)",
    "primaryForeground": "oklch(1.0000 0 0)",
    "secondary": "oklch(0.8214 0.0720 249.3482)",
    "secondaryForeground": "oklch(0.3211 0 0)",
    "muted": "oklch(0.8202 0.0213 91.6163)",
    "mutedForeground": "oklch(0.5382 0 0)",
    "accent": "oklch(0.6475 0.0642 117.4260)",
    "accentForeground": "oklch(1.0000 0 0)",
    "destructive": "oklch(0.6368 0.2078 25.3313)",
    "destructiveForeground": "oklch(1.0000 0 0)",
    "border": "oklch(0.8699 0 0)",
    "input": "oklch(0.8699 0 0)",
    "ring": "oklch(0.5676 0.2021 283.0838)",
    "chart1": "oklch(0.5676 0.2021 283.0838)",
    "chart2": "oklch(0.5261 0.1705 314.6534)",
    "chart3": "oklch(0.3390 0.1793 301.6848)",
    "chart4": "oklch(0.6746 0.1414 261.3380)",
    "chart5": "oklch(0.5880 0.0993 245.7394)",
    "radius": "0.5rem",
    "sidebarBackground": "oklch(0.9821 0 0)",
    "sidebarForeground": "oklch(0.3211 0 0)",
    "sidebarPrimary": "oklch(0.5676 0.2021 283.0838)",
    "sidebarPrimaryForeground": "oklch(1.0000 0 0)",
    "sidebarAccent": "oklch(0.6475 0.0642 117.4260)",
    "sidebarAccentForeground": "oklch(1.0000 0 0)",
    "sidebarBorder": "oklch(0.8699 0 0)",
    "sidebarRing": "oklch(0.5676 0.2021 283.0838)"
  },
  "dark": {
    "background": "oklch(0.2303 0.0125 264.2926)",
    "foreground": "oklch(0.9219 0 0)",
    "card": "oklch(0.3210 0.0078 223.6661)",
    "cardForeground": "oklch(0.9219 0 0)",
    "popover": "oklch(0.3210 0.0078 223.6661)",
    "popoverForeground": "oklch(0.9219 0 0)",
    "primary": "oklch(0.5676 0.2021 283.0838)",
    "primaryForeground": "oklch(1.0000 0 0)",
    "secondary": "oklch(0.3390 0.1793 301.6848)",
    "secondaryForeground": "oklch(0.9219 0 0)",
    "muted": "oklch(0.3867 0 0)",
    "mutedForeground": "oklch(0.7155 0 0)",
    "accent": "oklch(0.6746 0.1414 261.3380)",
    "accentForeground": "oklch(0.9219 0 0)",
    "destructive": "oklch(0.6368 0.2078 25.3313)",
    "destructiveForeground": "oklch(1.0000 0 0)",
    "border": "oklch(0.3867 0 0)",
    "input": "oklch(0.3867 0 0)",
    "ring": "oklch(0.5676 0.2021 283.0838)",
    "chart1": "oklch(0.5676 0.2021 283.0838)",
    "chart2": "oklch(0.5261 0.1705 314.6534)",
    "chart3": "oklch(0.3390 0.1793 301.6848)",
    "chart4": "oklch(0.6746 0.1414 261.3380)",
    "chart5": "oklch(0.5880 0.0993 245.7394)",
    "radius": "0.5rem",
    "sidebarBackground": "oklch(0.2303 0.0125 264.2926)",
    "sidebarForeground": "oklch(0.9219 0 0)",
    "sidebarPrimary": "oklch(0.5676 0.2021 283.0838)",
    "sidebarPrimaryForeground": "oklch(1.0000 0 0)",
    "sidebarAccent": "oklch(0.6746 0.1414 261.3380)",
    "sidebarAccentForeground": "oklch(0.9219 0 0)",
    "sidebarBorder": "oklch(0.3867 0 0)",
    "sidebarRing": "oklch(0.5676 0.2021 283.0838)"
  }
}
